{
  "$schema": "../../../schema/prijzen.schema.json",
  "versie": 1,
  "datum": "2026-09-25",
  "tijdzone": "Europe/Amsterdam",
  "valuta": "EUR",
  "btw": "exclusief",
  "opgehaaldOp": "2026-09-24T16:13:33.407Z",
  "stroom": {
    "eenheid": "EUR/kWh",
    "bron": "energyzero",
    "perUur": [
      {
        "start": "2026-09-25T00:00:00+02:00",
        "startUtc": "2026-09-24T22:00:00Z",
        "prijs": 0.181983
      },
      {
        "start": "2026-09-25T01:00:00+02:00",
        "startUtc": "2026-09-24T23:00:00Z",
        "prijs": 0.1722
      },
      {
        "start": "2026-09-25T02:00:00+02:00",
        "startUtc": "2026-09-25T00:00:00Z",
        "prijs": 0.16493
      },
      {
        "start": "2026-09-25T03:00:00+02:00",
        "startUtc": "2026-09-25T01:00:00Z",
        "prijs": 0.164477
      },
      {
        "start": "2026-09-25T04:00:00+02:00",
        "startUtc": "2026-09-25T02:00:00Z",
        "prijs": 0.16117
      },
      {
        "start": "2026-09-25T05:00:00+02:00",
        "startUtc": "2026-09-25T03:00:00Z",
        "prijs": 0.165863
      },
      {
        "start": "2026-09-25T06:00:00+02:00",
        "startUtc": "2026-09-25T04:00:00Z",
        "prijs": 0.1799
      },
      {
        "start": "2026-09-25T07:00:00+02:00",
        "startUtc": "2026-09-25T05:00:00Z",
        "prijs": 0.20757
      },
      {
        "start": "2026-09-25T08:00:00+02:00",
        "startUtc": "2026-09-25T06:00:00Z",
        "prijs": 0.21246
      },
      {
        "start": "2026-09-25T09:00:00+02:00",
        "startUtc": "2026-09-25T07:00:00Z",
        "prijs": 0.194707
      },
      {
        "start": "2026-09-25T10:00:00+02:00",
        "startUtc": "2026-09-25T08:00:00Z",
        "prijs": 0.155007
      },
      {
        "start": "2026-09-25T11:00:00+02:00",
        "startUtc": "2026-09-25T09:00:00Z",
        "prijs": 0.106008
      },
      {
        "start": "2026-09-25T12:00:00+02:00",
        "startUtc": "2026-09-25T10:00:00Z",
        "prijs": 0.061683
      },
      {
        "start": "2026-09-25T13:00:00+02:00",
        "startUtc": "2026-09-25T11:00:00Z",
        "prijs": 0.034928
      },
      {
        "start": "2026-09-25T14:00:00+02:00",
        "startUtc": "2026-09-25T12:00:00Z",
        "prijs": 0.043635
      },
      {
        "start": "2026-09-25T15:00:00+02:00",
        "startUtc": "2026-09-25T13:00:00Z",
        "prijs": 0.085855
      },
      {
        "start": "2026-09-25T16:00:00+02:00",
        "startUtc": "2026-09-25T14:00:00Z",
        "prijs": 0.14528
      },
      {
        "start": "2026-09-25T17:00:00+02:00",
        "startUtc": "2026-09-25T15:00:00Z",
        "prijs": 0.195252
      },
      {
        "start": "2026-09-25T18:00:00+02:00",
        "startUtc": "2026-09-25T16:00:00Z",
        "prijs": 0.240393
      },
      {
        "start": "2026-09-25T19:00:00+02:00",
        "startUtc": "2026-09-25T17:00:00Z",
        "prijs": 0.297403
      },
      {
        "start": "2026-09-25T20:00:00+02:00",
        "startUtc": "2026-09-25T18:00:00Z",
        "prijs": 0.252187
      },
      {
        "start": "2026-09-25T21:00:00+02:00",
        "startUtc": "2026-09-25T19:00:00Z",
        "prijs": 0.22425
      },
      {
        "start": "2026-09-25T22:00:00+02:00",
        "startUtc": "2026-09-25T20:00:00Z",
        "prijs": 0.20652
      },
      {
        "start": "2026-09-25T23:00:00+02:00",
        "startUtc": "2026-09-25T21:00:00Z",
        "prijs": 0.177
      }
    ]
  },
  "gas": null
}
